<xsd:schema xmlns:xsd="http://www.w3.org/2001/XMLSchema"> 
	<xsd:element name="filmy" type="typ_filmy"/> 
	<xsd:complexType name="typ_filmy"> 
		<xsd:sequence> 
			<xsd:element name="film" type="film_rozwiniecie" minOccurs="1" maxOccurs="unbounded"/>
		</xsd:sequence> 
		<xsd:attribute name="katalog" type="xsd:string" fixed="darmowe"/> 
	</xsd:complexType> 

	<xsd:element name="tytul" type="xsd:string"/> 
	<xsd:complexType name="film_rozwiniecie"> 
		<xsd:sequence> 
			<xsd:element ref="tytul" />
			<xsd:element name="ilosc_pobran" type="xsd:integer"/>
			<xsd:element name="srednia_cena">
				<xsd:complexType> 
					<xsd:simpleContent>
						<xsd:extension base="xsd:decimal">
							<xsd:attribute name="id" type="xsd:integer" /> 
							<xsd:attribute name="prod" type="xsd:string" default="yes"/> 
						</xsd:extension>
					</xsd:simpleContent>
				</xsd:complexType>
			</xsd:element>
			<xsd:element name="ogladalnosc" type="xsd:string" default="duÅ¼o"/>
			<xsd:element name="srednia_ocen" type="xsd:decimal"/>
			<xsd:element name="rok_produkcji" >
				<xsd:complexType> 
					<xsd:attribute name="nr" type="xsd:integer" /> 
				</xsd:complexType>
			</xsd:element>
		</xsd:sequence> 
		<xsd:attribute name="type" type="xsd:string"/> 
		<xsd:attribute name="lang" type="attrValid"/> 
	</xsd:complexType> 

	<xsd:simpleType name="attrValid"> 
		<xsd:restriction base="xsd:string"> 
			<xsd:pattern value="[A-Z]{2}"/> 
		</xsd:restriction> 
	</xsd:simpleType> 

</xsd:schema>