<?xml version="1.0" encoding="UTF-8" standalone="no"?><filmy xmlns:xsi="http://www.w3.org/2001/XMLSchema-instance" xsi:noNamespaceSchemaLocation="zad3.xsd">
	<film lang="EN" type="akcja">
		<tytul>Marsjanin</tytul>
		<ilosc_pobran>122</ilosc_pobran>
		<srednia_cena>18.52</srednia_cena>
		<ogladalnosc>36765</ogladalnosc>
		<srednia_ocen>7.6</srednia_ocen>
		<rok_produkcji nr="2015"/>
	</film>
	<film lang="EN" type="dramat">
		<tytul>Najdłuższa podróż</tytul>
		<ilosc_pobran>111</ilosc_pobran>
		<srednia_cena id="21">14.32</srednia_cena>
		<ogladalnosc>19923</ogladalnosc>
		<srednia_ocen>7.5</srednia_ocen>
		<rok_produkcji nr="2015"/>
	</film>
	<film lang="EN" type="komedia">
		<tytul>Praktykant</tytul>
		<ilosc_pobran>521</ilosc_pobran>
		<srednia_cena>17.44</srednia_cena>
		<ogladalnosc>23453</ogladalnosc>
		<srednia_ocen>7.5</srednia_ocen>
		<rok_produkcji nr="2015"/>
	</film> 
	<film lang="PL" type="dramat">
		<tytul>Układ zamknięty</tytul>
		<ilosc_pobran>28</ilosc_pobran>
		<srednia_cena id="21">14.33</srednia_cena>
		<ogladalnosc>17545</ogladalnosc>
		<srednia_ocen>7.4</srednia_ocen>
		<rok_produkcji nr="2013"/>
	</film>
<film lang="PL" type="horror"><tytul>Demonxx</tytul><ilosc_pobran>44</ilosc_pobran><srednia_cena>22.2</srednia_cena><ogladalnosc>23234</ogladalnosc><srednia_ocen>6.9</srednia_ocen><rok_produkcji nr="2016"/></film></filmy>